[
  {
    "sourceId": "capital-radar-live-state",
    "sourceType": "internal",
    "name": "Capital Radar live state snapshot",
    "baseUrl": "data/report-state.live.json",
    "trustTier": "primary",
    "allowedUses": [
      "fact",
      "market_signal",
      "internal_note"
    ],
    "refreshCadence": "on-build / on-refresh",
    "storagePolicy": "store_full_json_snapshot",
    "failureMode": "blocks live action permissions when stale or missing",
    "lastCheckedAt": "2026-10-19T21:24:12.160Z",
    "notes": "Authoritative local state container for holdings, quotes, macro rows, candidate state, and operational posture."
  },
  {
    "sourceId": "yahoo-chart-public",
    "sourceType": "market_data",
    "name": "Yahoo public chart endpoint",
    "baseUrl": "https://query1.finance.yahoo.com/v8/finance/chart/",
    "trustTier": "medium",
    "allowedUses": [
      "market_signal",
      "background"
    ],
    "refreshCadence": "intraday refresh when adapter runs",
    "storagePolicy": "store_normalized_price_rows_only",
    "failureMode": "prices may be stale or unofficial; freshness gate required before action",
    "lastCheckedAt": "2026-10-19T21:24:12.160Z",
    "notes": "Used for 1-minute latest price, daily trend, relative strength, and tape anomaly detection. Not thesis evidence by itself."
  },
  {
    "sourceId": "fred-public-series",
    "sourceType": "macro",
    "name": "FRED public macro, rates, and credit series",
    "baseUrl": "https://fred.stlouisfed.org/",
    "trustTier": "primary",
    "allowedUses": [
      "fact",
      "market_signal",
      "background"
    ],
    "refreshCadence": "daily or adapter refresh",
    "storagePolicy": "store_latest_series_observations",
    "failureMode": "macro regime confidence reduced if stale/missing",
    "lastCheckedAt": "2026-10-19T21:24:12.160Z",
    "notes": "Primary source family for Treasury rates, inflation expectations, Fed Funds, credit spreads, and liquidity context."
  },
  {
    "sourceId": "sec-company-submissions",
    "sourceType": "filing",
    "name": "SEC company submissions JSON",
    "baseUrl": "https://data.sec.gov/submissions/",
    "trustTier": "primary",
    "allowedUses": [
      "fact",
      "background"
    ],
    "refreshCadence": "daily for active holdings/candidates",
    "storagePolicy": "store_metadata_and_selected_primary_text_refs",
    "failureMode": "filing evidence unavailable; thesis promotions blocked if primary-source evidence missing",
    "lastCheckedAt": "2026-10-19T21:24:12.160Z",
    "notes": "Primary filings metadata for holdings and candidates. Future engine should add companyfacts and filing text extraction."
  },
  {
    "sourceId": "company-investor-relations",
    "sourceType": "ir",
    "name": "Company investor relations pages",
    "baseUrl": null,
    "trustTier": "high",
    "allowedUses": [
      "fact",
      "management_guidance",
      "background"
    ],
    "refreshCadence": "candidate/holding-specific source diff",
    "storagePolicy": "store_summary_and_raw_for_material_updates",
    "failureMode": "source-specific; blocked/JS-heavy pages require alternate primary source",
    "lastCheckedAt": "2026-10-19T21:24:12.160Z",
    "notes": "Curated per-company source graph. Not broad web search; specific pages selected by ticker evidence needs."
  },
  {
    "sourceId": "etf-holdings-pages",
    "sourceType": "market_data",
    "name": "ETF holdings and sector exposure pages",
    "baseUrl": null,
    "trustTier": "high",
    "allowedUses": [
      "fact",
      "market_signal",
      "background"
    ],
    "refreshCadence": "weekly or candidate-specific",
    "storagePolicy": "store_normalized_holdings_and_weights",
    "failureMode": "sector/adjacency graph less complete",
    "lastCheckedAt": "2026-10-19T21:24:12.160Z",
    "notes": "Used to map candidate adjacency, sector pressure, crowded baskets, and substitute exposures."
  },
  {
    "sourceId": "curated-rss-and-public-news",
    "sourceType": "news",
    "name": "Curated public RSS / source feeds",
    "baseUrl": null,
    "trustTier": "medium",
    "allowedUses": [
      "background",
      "sentiment",
      "market_signal"
    ],
    "refreshCadence": "15m-24h depending source",
    "storagePolicy": "store_url_timestamp_summary_claims_discard_low_value_html",
    "failureMode": "event causality remains unresolved; no final claims from blocked/low-quality extraction",
    "lastCheckedAt": "2026-10-19T21:24:12.160Z",
    "notes": "Future feed layer for real-time-ish event detection without whole-web search. Must cite and pass reliability gates."
  },
  {
    "sourceId": "capital-radar-internal-archive",
    "sourceType": "internal",
    "name": "Capital Radar internal archive and run logs",
    "baseUrl": "runs/capital-radar/",
    "trustTier": "primary",
    "allowedUses": [
      "internal_note",
      "background"
    ],
    "refreshCadence": "append-only per run",
    "storagePolicy": "store_full_markdown_archives_and_decision_logs",
    "failureMode": "learning loop impaired; current action gates unaffected",
    "lastCheckedAt": "2026-10-19T21:24:12.160Z",
    "notes": "Stores prior decisions, market reads, candidate promotions/rejections, and lessons learned."
  },
  {
    "sourceId": "yahoo-finance-rss-news",
    "sourceType": "news",
    "name": "Yahoo Finance RSS headline feed (materiality-scored)",
    "baseUrl": "https://feeds.finance.yahoo.com/rss/2.0/headline",
    "trustTier": "medium",
    "allowedUses": [
      "market_signal",
      "background"
    ],
    "refreshCadence": "every collect:news run; stale after 6h",
    "storagePolicy": "store_materiality_scored_headlines_with_timestamps",
    "failureMode": "news gate inactive; HIGH-materiality promotion evidence unavailable",
    "lastCheckedAt": "2026-10-19T21:24:12.160Z",
    "notes": "Covers all holdings and candidates. Score ≥8 = HIGH (earnings surprise, M&A, guidance). Score 5-7 = MEDIUM. Score 1-4 = LOW. Only HIGH items can support promotion evidence."
  },
  {
    "sourceId": "sec-xbrl-companyfacts",
    "sourceType": "filing",
    "name": "SEC EDGAR XBRL company-facts API",
    "baseUrl": "https://data.sec.gov/api/xbrl/companyfacts/",
    "trustTier": "primary",
    "allowedUses": [
      "fact",
      "background"
    ],
    "refreshCadence": "every collect:xbrl run; stale after 48h",
    "storagePolicy": "store_extracted_fundamentals_only",
    "failureMode": "fundamentals absent; holding and candidate valuation evidence thin",
    "lastCheckedAt": "2026-10-19T21:24:12.160Z",
    "notes": "Extracts: revenue, revenue growth YoY, net income, gross margin, EPS diluted, FCF, long-term debt, dilution flag. Skips ETF/leveraged tickers."
  }
]